{
  "id": "R-MERGE-POLICY-001",
  "title": "UNVERIFIED requirements are never mergeable",
  "criticality": "release_blocking",
  "owner_test": "tests/test_contract_seed_requirements.py::test_r_merge_policy_001_owner",
  "live_proof_key": "lp-merge-block-unverified",
  "required_behavior": [
    "Merge policy blocks when any requirement is UNVERIFIED"
  ],
  "forbidden_behavior": [
    "Merge allowed with overall UNVERIFIED",
    "Merge allowed when release-blocking requirement is UNVERIFIED"
  ],
  "user_visible_expectation": [
    "CI reports exact unverified requirement ids"
  ],
  "state_expectation": [
    "merge_gate_status=blocked when unverified_count>0"
  ],
  "code_hotspots": [
    "governance/verification/completion_matrix.py",
    ".github/workflows/ci.yml"
  ],
  "verification_methods": [
    "static_verification",
    "behavioral_verification",
    "live_flow_verification"
  ],
  "acceptance_tests": [
    "tests/test_completion_matrix_contract.py::test_merge_policy_blocks_when_overall_unverified"
  ],
  "done_rule": {
    "require_all_verifications_pass": true,
    "fail_closed_on_missing_evidence": true,
    "fail_on_forbidden_observation": true
  }
}
